### ISSUE TITLE
UDP port is unreachable

### ISSUE THREAD

**Issue by hirnstrudel** [AdguardTeam/AdGuardHome#2303]
I use AdGuardHome as a docker container on Ubuntu 20.04. I disabled DNSStubListener and DNS resolution works fine on the host and other LAN computers:
```
version: "2"
services:
  adguardhome:
    image: adguard/adguardhome
    container_name: adguard
    ports:
      - 53:53/tcp
      - 53:53/udp
#      - 853:853/tcp
      - 3000:3000/tcp
    volumes:
      - /media/storage/@app-data/adguard/work:/opt/adguardhome/work
      - /media/storage/@app-data/adguard/conf:/opt/adguardhome/conf
    restart: unless-stopped
```

 But I can't get a DNS response from any other container.
```
docker run --rm busybox nslookup google.com

;; connection timed out; no servers could be reached
```

When I connect tcpdump to docker0 I see that the DNS request is recieved and resolved by adguard. But the answer never makes it back to the other container.
```
22:19:43.005719 IP 172.17.0.2.56309 > helios64.domain: 256+ A? google.com. (28)
22:19:43.005813 IP 172.17.0.2.56309 > helios64.domain: 256+ AAAA? google.com. (28)
22:19:43.006837 IP helios64.domain > 172.17.0.2.56309: 256 1/0/0 AAAA 2a00:1450:4001:800::200e (56)
22:19:43.006897 IP 172.17.0.2 > helios64: ICMP 172.17.0.2 udp port 56309 unreachable, length 92
22:19:43.020658 IP helios64.domain > 172.17.0.2.56309: 256 1/0/0 A 216.58.212.174 (44)
22:19:43.020736 IP 172.17.0.2 > helios64: ICMP 172.17.0.2 udp port 56309 unreachable, length 80
```

If I specify the the IP of the docker bridge gateway of the container, everything works as expected. (But I really don't want to specify a different DNS Server for each docker network)
```
# docker call
docker run --rm --dns 172.17.0.1 busybox nslookup google.com

# tcpdump
22:19:06.256199 IP 172.17.0.2.33800 > helios64.domain: 256+ A? google.com. (28)
22:19:06.256297 IP 172.17.0.2.33800 > helios64.domain: 256+ AAAA? google.com. (28)
22:19:06.272056 IP helios64.domain > 172.17.0.2.33800: 256 1/0/0 A 172.217.16.206 (44)
22:19:06.272218 IP helios64.domain > 172.17.0.2.33800: 256 1/0/0 AAAA 2a00:1450:4001:800::200e (56)
```

Can anyone point me in the right direction to tackle this problem?
Thanks.

**Comment by ameshkov** [comment]
I am not an expert at docker-related issues so, unfortunately, I cannot help you.

Marked as "help wanted", maybe someone else can.

**Comment by westcoastdevv** [comment]
@hirnstrudel did you every solve this? I'm experiencing the same issue. The only fix I've found is use host networking which isn't ideal.

**Comment by hirnstrudel** [comment]
@westcoastdevv 
I didn't think so. In the meantime I switched to another homelab setup using podman quadlets.
