### ISSUE TITLE
AGH DNS over TLS port not 853?

### ISSUE THREAD

**Issue by rodalpho** [AdguardTeam/AdGuardHome#3304]
I have AdGuard Home running on a NAS device which I want to block from the internet for security purposes. I can't use DNS over HTTPS as that would require allowing port 443, so I set it up with DNS over TLS instead, then I set my firewall to allow outgoing port 853. 

Weird thing is, running Test Upstreams inside AGH says all the DNS servers are working properly!

I confirmed that outgoing 853/TCP works with the firewall rule active, and DNS over TLS works using kdig (not AGH) too:

```
root@Nas:/volume1/Media/Scratch# ./kdig -d @dns.quad9.net +tls-ca +tls-host=dns.quad9.net nyt.com
;; DEBUG: Querying for owner(nyt.com.), class(1), type(1), server(dns.quad9.net), port(853), protocol(TCP)
;; DEBUG: TLS, imported 138 system certificates
;; DEBUG: TLS, received certificate hierarchy:
;; DEBUG:  #1, C=US,ST=California,L=Berkeley,O=Quad9,CN=*.quad9.net
;; DEBUG:      SHA-256 PIN: /SlsviBkb05Y/8XiKF9+CZsgCtrqPQk5bh47o0R3/Cg=
;; DEBUG:  #2, C=US,O=DigiCert Inc,CN=DigiCert ECC Secure Server CA
;; DEBUG:      SHA-256 PIN: PZXN3lRAy+8tBKk2Ox6F7jIlnzr2Yzmwqc3JnyfXoCw=
;; DEBUG: TLS, skipping certificate PIN check
;; DEBUG: TLS, The certificate is trusted. 
;; TLS session (TLS1.3)-(ECDHE-SECP256R1)-(ECDSA-SECP256R1-SHA256)-(AES-256-GCM)
;; ->>HEADER<<- opcode: QUERY; status: NOERROR; id: 54127
;; Flags: qr rd ra; QUERY: 1; ANSWER: 4; AUTHORITY: 0; ADDITIONAL: 1

;; EDNS PSEUDOSECTION:
;; Version: 0; flags: ; UDP size: 512 B; ext-rcode: NOERROR

;; QUESTION SECTION:
;; nyt.com.                     IN      A

;; ANSWER SECTION:
nyt.com.                500     IN      A       151.101.65.164
nyt.com.                500     IN      A       151.101.193.164
nyt.com.                500     IN      A       151.101.1.164
nyt.com.                500     IN      A       151.101.129.164

;; Received 100 B
;; Time 2021-07-02 17:08:01 EDT
;; From 149.112.112.112@853(TCP) in 51.0 ms
```

My upstream DNS servers are configured as follows:

```
[///local/10.10.10.in-addr.arpa/20.10.10.in-addr.arpa/30.10.10.in-addr.arpa/100.10.10.in-addr.arpa/]10.10.10.1
tls://1.1.1.1
tls://dns.google
tls://dns.quad9.net
```

_However,_ DNS queries to AdGuard Home simply time out. I ran TCPdump and confirmed there were no outgoing packets to port 853 when I queried AdGuard Home from another host. I also confirmed via TCPdump that they _were_ properly going to port 853 when running kdig above.

Working TCPdump (using kdig locally):
```

root@Nas:/volume1/Media/Scratch# tcpdump -i any -nn src host 10.10.10.99 and port 853
tcpdump: verbose output suppressed, use -v or -vv for full protocol decode
listening on any, link-type LINUX_SLL (Linux cooked v1), capture size 262144 bytes
17:10:38.566325 IP 10.10.10.99.34870 > 149.112.112.112.853: Flags [S], seq 1838702951, win 29200, options [mss 1460,sackOK,TS val 171436995 ecr 0,nop,wscale 7], length 0
17:10:38.570679 IP 10.10.10.99.34870 > 149.112.112.112.853: Flags [.], ack 3202175091, win 229, options [nop,nop,TS val 171436999 ecr 1364992230], length 0
17:10:38.571193 IP 10.10.10.99.34870 > 149.112.112.112.853: Flags [P.], seq 0:337, ack 1, win 229, options [nop,nop,TS val 171437000 ecr 1364992230], length 337
17:10:38.576997 IP 10.10.10.99.34870 > 149.112.112.112.853: Flags [.], ack 2901, win 274, options [nop,nop,TS val 171437006 ecr 1364992236], length 0
17:10:38.577545 IP 10.10.10.99.34870 > 149.112.112.112.853: Flags [P.], seq 337:343, ack 2901, win 274, options [nop,nop,TS val 171437006 ecr 1364992236], length 6
17:10:38.622433 IP 10.10.10.99.34870 > 149.112.112.112.853: Flags [P.], seq 343:569, ack 2901, win 274, options [nop,nop,TS val 171437051 ecr 1364992282], length 226
17:10:38.627534 IP 10.10.10.99.34870 > 149.112.112.112.853: Flags [.], ack 3379, win 319, options [nop,nop,TS val 171437056 ecr 1364992287], length 0
17:10:38.627976 IP 10.10.10.99.34870 > 149.112.112.112.853: Flags [P.], seq 569:593, ack 3503, win 319, options [nop,nop,TS val 171437057 ecr 1364992287], length 24
17:10:38.628011 IP 10.10.10.99.34870 > 149.112.112.112.853: Flags [F.], seq 593, ack 3503, win 319, options [nop,nop,TS val 171437057 ecr 1364992287], length 0
17:10:38.632666 IP 10.10.10.99.34870 > 149.112.112.112.853: Flags [R], seq 1838703546, win 0, length 0
17:10:38.632692 IP 10.10.10.99.34870 > 149.112.112.112.853: Flags [R], seq 1838703546, win 0, length 0
```

When querying AGH, tcpdump doesn't show anything. So AGH isn't even _trying_ to access port 853. 

So my question is, what port is AdGuard Home using for DNS over TLS, if it isn't 853?

**Comment by rodalpho** [comment]
Please ignore-- this is broken for port 53 too for some reason.
