### ISSUE TITLE
$dnsrewrite=NOERROR;NS .. no NS rewrite?

### ISSUE THREAD

**Issue by bcookatpcsd** [AdguardTeam/AdGuardHome#5358]
### Prerequisites

- [X] I have checked the [Wiki](https://github.com/AdguardTeam/AdGuardHome/wiki) and [Discussions](https://github.com/AdguardTeam/AdGuardHome/discussions) and found no answer

- [X] I have searched other issues and found no duplicates

- [X] I want to request a feature or enhancement and not ask a question

### Description

Trying to implement a feature of a software product.. and it seems we cannot manipulate NS records.. 
(https://www.papercut.com/help/manuals/mobility-print/set-up/configure/discover-printers-dns/#step-1-select-your-search-domain)

latest adguard/adguardhome:beta [v0.108.0-b.24]

According to: 
https://github.com/AdguardTeam/AdGuardHome/wiki/Hosts-Blocklists

NS spoofing appears to not be a feature.. as if NS is not a valid RCODE

(from the Hosts-Blocklists)
Since v0.107.3 response codes NOERROR, NXDOMAIN, and SERVFAIL are also supported.

The full syntax is of the form RCODE;RRTYPE;VALUE:

in the filtering list:

```
||b._dns-sd._udp.0.0.20.10.in-addr.arpa^$dnsrewrite=NOERROR;PTR;pc-printer-discovery.
||lb._dns-sd._udp.0.0.20.10.in-addr.arpa^$dnsrewrite=NOERROR;PTR;pc-printer-discovery.
||pc-printer-discovery^$dnsrewrite=NOERROR;NS;mobility-print-host.
||mobility-print-host^$dnsrewrite=NOERROR;A;10.20.0.70
```

```
# drill -t ptr b._dns-sd._udp.0.0.20.10.in-addr.arpa @10.20.0.43
;; ->>HEADER<<- opcode: QUERY, rcode: NOERROR, id: 35055
;; flags: qr rd ra ; QUERY: 1, ANSWER: 1, AUTHORITY: 0, ADDITIONAL: 0
;; QUESTION SECTION:
;; b._dns-sd._udp.0.0.20.10.in-addr.arpa.       IN      PTR

;; ANSWER SECTION:
b._dns-sd._udp.0.0.20.10.in-addr.arpa.  300     IN      PTR     pc-printer-discovery.

;; AUTHORITY SECTION:

;; ADDITIONAL SECTION:

;; Query time: 0 msec
;; SERVER: 10.20.0.43
```
(this query shows in the logs)

The NS query is never shown in the logs.. 

 ```drill -t ns pc-printer-discovery @10.20.0.43 -V5
;; ->>HEADER<<- opcode: QUERY, rcode: NOERROR, id: 0
;; flags: rd ; QUERY: 1, ANSWER: 0, AUTHORITY: 0, ADDITIONAL: 0
;; QUESTION SECTION:
;; pc-printer-discovery.        IN      NS

;; ANSWER SECTION:

;; AUTHORITY SECTION:

;; ADDITIONAL SECTION:

;; Query time: 0 msec
;; WHEN: Fri Jan 13 13:57:50 2023
;; MSG SIZE  rcvd: 0
Error: error sending query: Could not send or receive, because of network error
```

and on the agh host.. 

``` tcpdump -v -i enp1s0f0.69 src host 10.20.0.6 -n -vvv | grep NS
    10.20.0.6.14338 > 10.20.0.43.53: Flags [P.], cksum 0xf7e6 (correct), seq 0:40, ack 1, win 83, options [nop,nop,TS val 774747527 ecr 3151008100], length 40 18561+ NS? pc-printer-discovery. (38)
    10.20.0.6.14350 > 10.20.0.43.53: Flags [P.], cksum 0xd644 (correct), seq 0:40, ack 1, win 83, options [nop,nop,TS val 774752531 ecr 3151013104], length 40 18561+ NS? pc-printer-discovery. (38)
    10.20.0.6.3386 > 10.20.0.43.53: Flags [P.], cksum 0x0297 (correct), seq 0:40, ack 1, win 83, options [nop,nop,TS val 774757536 ecr 3151018109], length 40 18561+ NS? pc-printer-discovery. (38)
```

But if I comment out my dnsrewrite NS entry.. 

No error.. 

Am I just (hopefully) formatting the NS rewrite entry incorrectly? 

Thanks in advance.. 

Sorry for the problem if it's me..
