### DISCUSSION TITLE
Resolve "local_domain_name" entries from forwarder

### DISCUSSION THREAD

**Discussion by Ziris85** [AdguardTeam/AdGuardHome#6324] [Q&A]
Hello All,

I have AGH configured with `local_domain_name` set to **lan**, and client hostnames retrieved from DHCP all work fine when I query AGH directly. However, if I set up a bind server with my AGH server as a forwarder, and then try to query a .lan hostname from it, it complains about DNSSEC:

```
named[1748]: insecurity proof failed resolving 'client.lan/A/IN': 192.168.1.3#53
```

If I set `dnssec-validation` to **no**(the default is **auto**) then the issue goes away and forwarded queries return normally. A tcpdump on the AGH server shows a little more about what's happening:

```
00:17:09.268105 IP 192.168.1.106.51980 > 192.168.1.3.53: 5903+% [1au] A? client.lan. (52)
00:17:09.268354 IP 192.168.1.3.53 > 192.168.1.106.51980: 5903 1/0/0 A 192.168.1.114 (45)
00:17:09.268803 IP 192.168.1.106.38011 > 192.168.1.3.53: 61203+% [1au] DS? lan. (44)
00:17:09.332822 IP 192.168.1.3.53 > 192.168.1.106.38011: 61203 NXDomain$ 0/6/1 (1028)
00:17:09.333511 IP 192.168.1.106.40720 > 192.168.1.3.53: 52047+% [1au] DS? client.lan. (52)
00:17:09.412385 IP 192.168.1.3.53 > 192.168.1.106.40720: 52047 NXDomain$ 0/6/1 (1036)
```

As we can see, AGH actually responds to the original A record request properly, but then when bind starts asking questions about DS records, it just shrugs its shoulders and ultimately causes the query to fail.

I found bug #6156 and thought it might be related, so I tried switching my snap channel to the edge release, but the behavior persisted.

For the sake of argument (and because this is the case in my particular example), let's say I'm not able to modify the `dnssec-validation` entry in the bind config. Is there a way to resolve this?

Thanks in advance!
