### ISSUE TITLE
DNS service stopping for only Proxmox

### ISSUE THREAD

**Issue by Searchcat37** [AdguardTeam/AdGuardHome#8246]
### Prerequisites

- [x] I have checked the [Wiki](https://github.com/AdguardTeam/AdGuardHome/wiki) and [Discussions](https://github.com/AdguardTeam/AdGuardHome/discussions/categories/q-a) and found no answer

- [x] I have searched other issues and found no duplicates

- [x] I want to report a bug and not [ask a question or ask for help](https://github.com/AdguardTeam/AdGuardHome/discussions/categories/q-a)

- [x] I have set up AdGuard Home correctly and [configured clients to use it](https://github.com/AdguardTeam/AdGuardHome/wiki/Clients). (Use the [Discussions](https://github.com/AdguardTeam/AdGuardHome/discussions/categories/q-a) for help with installing and configuring clients.)

### Platform (OS and CPU architecture)

Linux, AMD64 (aka x86_64)

### Installation

Custom package (OpenWrt, HomeAssistant, etc; please mention in the description)

### Setup

On one machine

### AdGuard Home version

v0.107.71

### Action

Once a day, I have to restart the container, or DNS queries fail on Proxmox only. Any other device has no issues, still making DNS queries, besides a random message from GWifi saying my internet is offline.

ping on Proxmox
```sh
root@pve1:~# ping google.com
ping: google.com: Temporary failure in name resolution
```

nslookup on Proxmox
```sh
root@pve1:~# nslookup -debug -type=a 'google.com' '192.168.86.104'
;; communications error to 192.168.86.104#53: timed out
;; communications error to 192.168.86.104#53: timed out
Server:         192.168.86.104
Address:        192.168.86.104#53

------------
    QUESTIONS:
        google.com, type = A, class = IN
    ANSWERS:
    ->  google.com
        internet address = 142.250.9.138
        ttl = 30
    ->  google.com
        internet address = 142.250.9.101
        ttl = 30
    ->  google.com
        internet address = 142.250.9.102
        ttl = 30
    ->  google.com
        internet address = 142.250.9.139
        ttl = 30
    ->  google.com
        internet address = 142.250.9.113
        ttl = 30
    ->  google.com
        internet address = 142.250.9.100
        ttl = 30
    AUTHORITY RECORDS:
    ADDITIONAL RECORDS:
------------
Non-authoritative answer:
Name:   google.com
Address: 142.250.9.138
Name:   google.com
Address: 142.250.9.101
Name:   google.com
Address: 142.250.9.102
Name:   google.com
Address: 142.250.9.139
Name:   google.com
Address: 142.250.9.113
Name:   google.com
Address: 142.250.9.100
```

### Expected result

AdGuard not needing a daily restart to keep DNS queries working on Proxmox.

### Actual result

Once a day, DNS queries will start failing on Proxmox until AdGuard is restarted.

### Additional information and/or screenshots

AdGuard Home is deployed in an LXC container.

**Comment by tjharman** [comment]
Is this LXC only for AdguardHome?
What do the AdGuardHome logs show?
Are there any interesting messages in dmesg on the Proxmox host itself?

You haven't really given much to go on here, but I doubt this is an AdguardHome issue, likelier the LXC running out of memory and OOMing the AdGuardHome process or similar.

**Comment by Searchcat37** [comment]
The LXC only runs AdguardHome-Alpine

You mean the query log, correct?

dmesg has nothing mentioning any errors with that LXC container.

The AdGuardHome process never stopped. It is still running and taking queries, just not from anything running on the Proxmox server

**Comment by tjharman** [comment]
When it's failed, do a tcpdump on your Proxmox host on the Interface between the Host and the LXC

```tcpdump -i fwbr200i0 udp port 53```

Then what does a similar tcpdump show running within the LXC?

What do you see from a traffic perspective?

Given that you say other hosts can still talk to the LXC Port 53 (something I missed in your original post) I'd also suggest logging this on the Proxmox forums.  If AdGuardHome is still running and answering queries it seems less likely to be an AdGuardHome issue and likelier a network/config/design of how LXC containers work under Proxmox.

Finally no I don't mean the querylog, I mean the AdguardHome log

I don't run AdGuardHome in a LXC, just as a standalone binary but for me the file is called adguard.log and is a text file with log messages (not query logs)

**Comment by Searchcat37** [comment]
I will give that a go, once it has failed again. I couldn't find the .log file, so I had to set it manually. I will also see what the forums say. Thanks for the help!

**Comment by Searchcat37** [comment]
Welp, happened again. took 4 days tho lol. Looking at tcp dump for some reason adguard is just not responding.
```
root@pve1:~# tcpdump -i fwbr104i0 udp port 53 and src 192.168.86.99 or dst 192.168.86.99
tcpdump: verbose output suppressed, use -v[v]... for full protocol decode
listening on fwbr104i0, link-type EN10MB (Ethernet), snapshot length 262144 bytes
18:08:19.647103 IP pve1.lan.36695 > 192.168.86.104.domain: 34638+ A? google.com. (28)
18:08:19.647132 IP pve1.lan.36695 > 192.168.86.104.domain: 19544+ AAAA? google.com. (28)
18:08:19.687438 IP pve1.lan.56576 > 192.168.86.104.domain: 48103+ PTR? 104.86.168.192.in-addr.arpa. (45)
18:08:24.652220 IP pve1.lan.36695 > 192.168.86.104.domain: 34638+ A? google.com. (28)
18:08:24.652255 IP pve1.lan.36695 > 192.168.86.104.domain: 19544+ AAAA? google.com. (28)
18:08:24.688177 ARP, Reply 192.168.86.104 is-at bc:24:11:99:07:3e (oui Unknown), length 28
18:08:24.692203 IP pve1.lan.56576 > 192.168.86.104.domain: 48103+ PTR? 104.86.168.192.in-addr.arpa. (45)
18:08:29.657339 IP pve1.lan.48330 > 192.168.86.104.domain: 11702+ A? google.com.lan. (32)
18:08:29.657361 IP pve1.lan.48330 > 192.168.86.104.domain: 9907+ AAAA? google.com.lan. (32)
18:08:34.662377 IP pve1.lan.48330 > 192.168.86.104.domain: 11702+ A? google.com.lan. (32)
18:08:34.662396 IP pve1.lan.48330 > 192.168.86.104.domain: 9907+ AAAA? google.com.lan. (32)
```

**Comment by tjharman** [comment]
and ```bc:24:11:99:07:e3``` is the MAC of the Interface in the LXC?

When you do a TCPDUMP within the LXC what do you see, are the packets making it into the LXC?

**Comment by Searchcat37** [comment]
Figured out the problem after checking the AdGuard logs, turns out I needed to turn off "Private reverse DNS servers".

```
adguard:/opt/AdGuardHome/logs# tail adguard-home.log
2026/02/16 23:11:47.231257 [error] dnsproxy: response received upstream_type=local addr=192.168.86.1:53 proto=udp status="exchanging with 192.168.86.1:53 over udp: read udp 192.168.86.104:57028->192.168.86.1:53: i/o timeout"
2026/02/16 23:11:47.231335 [error] dnsproxy: exchange failed upstream=192.168.86.1:53 question=";lb._dns-sd._udp.0.86.168.192.in-addr.arpa.\tIN\t PTR" duration=2.000990069s err="exchanging with 192.168.86.1:53 over udp: read udp 192.168.86.104:57028->192.168.86.1:53: i/o timeout"
2026/02/16 23:11:47.232495 [error] dnsproxy: response received upstream_type=local addr=192.168.86.1:53 proto=udp status="exchanging with 192.168.86.1:53 over udp: read udp 192.168.86.104:60816->192.168.86.1:53: i/o timeout"
2026/02/16 23:11:47.232518 [error] dnsproxy: exchange failed upstream=192.168.86.1:53 question=";lb._dns-sd._udp.0.86.168.192.in-addr.arpa.\tIN\t PTR" duration=2.000536414s err="exchanging with 192.168.86.1:53 over udp: read udp 192.168.86.104:60816->192.168.86.1:53: i/o timeout"
2026/02/16 23:11:47.233662 [error] dnsproxy: response received upstream_type=local addr=192.168.86.1:53 proto=udp status="exchanging with 192.168.86.1:53 over udp: read udp 192.168.86.104:33890->192.168.86.1:53: i/o timeout"
2026/02/16 23:11:47.233678 [error] dnsproxy: exchange failed upstream=192.168.86.1:53 question=";lb._dns-sd._udp.0.86.168.192.in-addr.arpa.\tIN\t PTR" duration=2.001064139s err="exchanging with 192.168.86.1:53 over udp: read udp 192.168.86.104:33890->192.168.86.1:53: i/o timeout"
2026/02/16 23:11:47.233761 [error] dnsproxy: response received upstream_type=local addr=192.168.86.1:53 proto=udp status="exchanging with 192.168.86.1:53 over udp: read udp 192.168.86.104:51860->192.168.86.1:53: i/o timeout"
2026/02/16 23:11:47.233798 [error] dnsproxy: exchange failed upstream=192.168.86.1:53 question=";lb._dns-sd._udp.0.86.168.192.in-addr.arpa.\tIN\t PTR" duration=2.00106486s err="exchanging with 192.168.86.1:53 over udp: read udp 192.168.86.104:51860->192.168.86.1:53: i/o timeout"
2026/02/16 23:11:47.863874 [error] dnsproxy: response received upstream_type=local addr=192.168.86.1:53 proto=udp status="exchanging with 192.168.86.1:53 over udp: read udp 192.168.86.104:55642->192.168.86.1:53: i/o timeout"
2026/02/16 23:11:47.863917 [error] dnsproxy: exchange failed upstream=192.168.86.1:53 question=";lb._dns-sd._udp.0.86.168.192.in-addr.arpa.\tIN\t PTR" duration=2.001209402s err="exchanging with 192.168.86.1:53 over udp: read udp 192.168.86.104:55642->192.168.86.1:53: i/o timeout"
adguard:/opt/AdGuardHome/logs# 
```

**Comment by tjharman** [comment]
I don't think that setting would stop your AdGuardHome from responding at all.

**Comment by Searchcat37** [comment]
I don't know, but that fixed it I can ping domains from Proxmox now
